root@ubuntu-s-2vcpu-4gb-tor1-01:~# tcpdump -n -i eth0
tcpdump: verbose output suppressed, use -v[v]... for full protocol decode
listening on eth0, link-type EN10MB (Ethernet), snapshot length 262144 bytes
22:44:06.645449 IP 165.22.233.151.22 > 57.134.178.25.49834: Flags [P.], seq 3807604229:3807604417, ack 4153208181, win 4162, length 188
22:44:06.646002 IP 57.134.178.25.49834 > 165.22.233.151.22: Flags [P.], seq 1:37, ack 0, win 5851, length 36
22:44:06.646084 IP 165.22.233.151.22 > 57.134.178.25.49834: Flags [P.], seq 188:224, ack 37, win 4162, length 36
22:44:06.652316 IP 57.134.178.25.49834 > 165.22.233.151.22: Flags [.], ack 224, win 5850, length 0
22:44:06.676798 IP 57.134.178.25.49834 > 165.22.233.151.22: Flags [P.], seq 37:73, ack 224, win 5850, length 36
22:44:06.676939 IP 165.22.233.151.22 > 57.134.178.25.49834: Flags [P.], seq 224:260, ack 73, win 4162, length 36
22:44:06.707272 IP 57.134.178.25.49834 > 165.22.233.151.22: Flags [P.], seq 73:109, ack 260, win 5850, length 36
22:44:06.707410 IP 165.22.233.151.22 > 57.134.178.25.49834: Flags [P.], seq 260:296, ack 109, win 4162, length 36
22:44:06.723080 IP 165.22.233.151.22 > 57.134.178.25.49834: Flags [P.], seq 296:1252, ack 109, win 4162, length 956
22:44:06.734627 IP 57.134.178.25.49834 > 165.22.233.151.22: Flags [.], ack 1252, win 5846, length 0
22:44:06.734863 IP 57.134.178.25.49834 > 165.22.233.151.22: Flags [P.], seq 109:145, ack 1252, win 5846, length 36
22:44:06.735008 IP 165.22.233.151.22 > 57.134.178.25.49834: Flags [P.], seq 1252:1288, ack 145, win 4162, length 36
22:44:06.768134 IP 57.134.178.25.49834 > 165.22.233.151.22: Flags [P.], seq 145:181, ack 1288, win 5846, length 36
22:44:06.768314 IP 165.22.233.151.22 > 57.134.178.25.49834: Flags [P.], seq 1288:1324, ack 181, win 4162, length 36
22:44:06.799290 IP 57.134.178.25.49834 > 165.22.233.151.22: Flags [P.], seq 181:217, ack 1324, win 5846, length 36
22:44:06.799457 IP 165.22.233.151.22 > 57.134.178.25.49834: Flags [P.], seq 1324:1360, ack 217, win 4162, length 36
22:44:06.822482 IP 129.18.228.178.54638 > 165.22.233.151.22: Flags [P.], seq 197327094:197327178, ack 326954597, win 501, options [nop,nop,TS val 2734247131 ecr 3998171601], length 84
22:44:06.826945 IP 165.22.233.151.22 > 57.134.178.25.49834: Flags [P.], seq 1360:2500, ack 217, win 4162, length 1140
22:44:06.831544 IP 57.134.178.25.49834 > 165.22.233.151.22: Flags [P.], seq 217:253, ack 1360, win 5846, length 36
22:44:06.831719 IP 165.22.233.151.22 > 57.134.178.25.49834: Flags [P.], seq 2500:2536, ack 253, win 4162, length 36
22:44:06.833279 IP 57.134.178.25.49834 > 165.22.233.151.22: Flags [.], ack 2500, win 5851, length 0
22:44:06.838415 IP 57.134.178.25.49834 > 165.22.233.151.22: Flags [.], ack 2536, win 5851, length 0
22:44:06.859944 IP 57.134.178.25.49834 > 165.22.233.151.22: Flags [P.], seq 253:289, ack 2536, win 5851, length 36
22:44:06.860121 IP 165.22.233.151.22 > 57.134.178.25.49834: Flags [P.], seq 2536:2572, ack 289, win 4162, length 36
22:44:06.862649 IP 165.22.233.151.22 > 129.18.228.178.54638: Flags [.], ack 84, win 524, options [nop,nop,TS val 3998182403 ecr 2734247131], length 0
22:44:06.890156 IP 57.134.178.25.49834 > 165.22.233.151.22: Flags [P.], seq 289:325, ack 2572, win 5851, length 36
22:44:06.890334 IP 165.22.233.151.22 > 57.134.178.25.49834: Flags [P.], seq 2572:2608, ack 325, win 4162, length 36
22:44:06.921574 IP 57.134.178.25.49834 > 165.22.233.151.22: Flags [P.], seq 325:361, ack 2608, win 5850, length 36
22:44:06.921745 IP 165.22.233.151.22 > 57.134.178.25.49834: Flags [P.], seq 2608:2644, ack 361, win 4162, length 36
22:44:06.931042 IP 165.22.233.151.22 > 57.134.178.25.49834: Flags [P.], seq 2644:4088, ack 361, win 4162, length 1444
22:44:06.937706 IP 57.134.178.25.49834 > 165.22.233.151.22: Flags [.], ack 4088, win 5851, length 0
22:44:06.951787 IP 57.134.178.25.49834 > 165.22.233.151.22: Flags [P.], seq 361:397, ack 4088, win 5851, length 36
22:44:06.951930 IP 165.22.233.151.22 > 57.134.178.25.49834: Flags [P.], seq 4088:4124, ack 397, win 4162, length 36
22:44:06.981965 IP 57.134.178.25.49834 > 165.22.233.151.22: Flags [P.], seq 397:433, ack 4124, win 5851, length 36
22:44:06.982148 IP 165.22.233.151.22 > 57.134.178.25.49834: Flags [P.], seq 4124:4160, ack 433, win 4162, length 36
22:44:07.012095 IP 57.134.178.25.49834 > 165.22.233.151.22: Flags [P.], seq 433:469, ack 4160, win 5851, length 36
22:44:07.012243 IP 165.22.233.151.22 > 57.134.178.25.49834: Flags [P.], seq 4160:4196, ack 469, win 4162, length 36
^C
37 packets captured
47 packets received by filter
0 packets dropped by kernel
