root@ubuntu-s-2vcpu-4gb-tor1-01:~# tcpdump -r 0001.pcap
reading from file 0001.pcap, link-type EN10MB (Ethernet), snapshot length 262144
22:41:32.325190 IP ubuntu-s-2vcpu-4gb-tor1-01.ssh > d57-134-178-25.home.cgocable.net.49834: Flags [P.], seq 3807453841:3807453901, ack 4153170777, win 4162, length 60
22:41:32.325260 IP ubuntu-s-2vcpu-4gb-tor1-01.ssh > d57-134-178-25.home.cgocable.net.49834: Flags [P.], seq 60:160, ack 1, win 4162, length 100
22:41:32.331974 IP d57-134-178-25.home.cgocable.net.49834 > ubuntu-s-2vcpu-4gb-tor1-01.ssh: Flags [.], ack 60, win 5851, length 0
22:41:32.332123 IP d57-134-178-25.home.cgocable.net.49834 > ubuntu-s-2vcpu-4gb-tor1-01.ssh: Flags [P.], seq 1:37, ack 160, win 5851, length 36
22:41:32.332249 IP ubuntu-s-2vcpu-4gb-tor1-01.ssh > d57-134-178-25.home.cgocable.net.49834: Flags [P.], seq 160:196, ack 37, win 4162, length 36
22:41:32.355119 IP d57-134-178-25.home.cgocable.net.49834 > ubuntu-s-2vcpu-4gb-tor1-01.ssh: Flags [P.], seq 37:73, ack 196, win 5850, length 36
22:41:32.355295 IP ubuntu-s-2vcpu-4gb-tor1-01.ssh > d57-134-178-25.home.cgocable.net.49834: Flags [P.], seq 196:232, ack 73, win 4162, length 36
22:41:32.385487 IP d57-134-178-25.home.cgocable.net.49834 > ubuntu-s-2vcpu-4gb-tor1-01.ssh: Flags [P.], seq 73:109, ack 232, win 5850, length 36
22:41:32.385752 IP ubuntu-s-2vcpu-4gb-tor1-01.ssh > d57-134-178-25.home.cgocable.net.49834: Flags [P.], seq 232:268, ack 109, win 4162, length 36
22:41:32.415787 IP d57-134-178-25.home.cgocable.net.49834 > ubuntu-s-2vcpu-4gb-tor1-01.ssh: Flags [P.], seq 109:145, ack 268, win 5850, length 36
22:41:32.415979 IP ubuntu-s-2vcpu-4gb-tor1-01.ssh > d57-134-178-25.home.cgocable.net.49834: Flags [P.], seq 268:304, ack 145, win 4162, length 36
22:41:32.447071 IP d57-134-178-25.home.cgocable.net.49834 > ubuntu-s-2vcpu-4gb-tor1-01.ssh: Flags [P.], seq 145:181, ack 304, win 5850, length 36
22:41:32.447262 IP ubuntu-s-2vcpu-4gb-tor1-01.ssh > d57-134-178-25.home.cgocable.net.49834: Flags [P.], seq 304:340, ack 181, win 4162, length 36
22:41:32.478384 IP d57-134-178-25.home.cgocable.net.49834 > ubuntu-s-2vcpu-4gb-tor1-01.ssh: Flags [P.], seq 181:217, ack 340, win 5850, length 36
22:41:32.478743 IP ubuntu-s-2vcpu-4gb-tor1-01.ssh > d57-134-178-25.home.cgocable.net.49834: Flags [P.], seq 340:376, ack 217, win 4162, length 36
22:41:32.508545 IP d57-134-178-25.home.cgocable.net.49834 > ubuntu-s-2vcpu-4gb-tor1-01.ssh: Flags [P.], seq 217:253, ack 376, win 5850, length 36
22:41:32.508741 IP ubuntu-s-2vcpu-4gb-tor1-01.ssh > d57-134-178-25.home.cgocable.net.49834: Flags [P.], seq 376:412, ack 253, win 4162, length 36
22:41:32.539096 IP d57-134-178-25.home.cgocable.net.49834 > ubuntu-s-2vcpu-4gb-tor1-01.ssh: Flags [P.], seq 253:289, ack 412, win 5850, length 36
22:41:32.539288 IP ubuntu-s-2vcpu-4gb-tor1-01.ssh > d57-134-178-25.home.cgocable.net.49834: Flags [P.], seq 412:448, ack 289, win 4162, length 36
22:41:32.569468 IP d57-134-178-25.home.cgocable.net.49834 > ubuntu-s-2vcpu-4gb-tor1-01.ssh: Flags [P.], seq 289:325, ack 448, win 5849, length 36
22:41:32.569729 IP ubuntu-s-2vcpu-4gb-tor1-01.ssh > d57-134-178-25.home.cgocable.net.49834: Flags [P.], seq 448:484, ack 325, win 4162, length 36
22:41:32.599856 IP d57-134-178-25.home.cgocable.net.49834 > ubuntu-s-2vcpu-4gb-tor1-01.ssh: Flags [P.], seq 325:361, ack 484, win 5849, length 36
22:41:32.600064 IP ubuntu-s-2vcpu-4gb-tor1-01.ssh > d57-134-178-25.home.cgocable.net.49834: Flags [P.], seq 484:520, ack 361, win 4162, length 36
22:41:32.629345 IP d57-134-178-25.home.cgocable.net.49834 > ubuntu-s-2vcpu-4gb-tor1-01.ssh: Flags [P.], seq 361:397, ack 520, win 5849, length 36
22:41:32.629566 IP ubuntu-s-2vcpu-4gb-tor1-01.ssh > d57-134-178-25.home.cgocable.net.49834: Flags [P.], seq 520:556, ack 397, win 4162, length 36
22:41:32.659414 IP d57-134-178-25.home.cgocable.net.49834 > ubuntu-s-2vcpu-4gb-tor1-01.ssh: Flags [P.], seq 397:433, ack 556, win 5849, length 36
22:41:32.659664 IP ubuntu-s-2vcpu-4gb-tor1-01.ssh > d57-134-178-25.home.cgocable.net.49834: Flags [P.], seq 556:592, ack 433, win 4162, length 36
22:41:32.689797 IP d57-134-178-25.home.cgocable.net.49834 > ubuntu-s-2vcpu-4gb-tor1-01.ssh: Flags [P.], seq 433:469, ack 592, win 5849, length 36
22:41:32.690076 IP ubuntu-s-2vcpu-4gb-tor1-01.ssh > d57-134-178-25.home.cgocable.net.49834: Flags [P.], seq 592:628, ack 469, win 4162, length 36
22:41:32.720983 IP d57-134-178-25.home.cgocable.net.49834 > ubuntu-s-2vcpu-4gb-tor1-01.ssh: Flags [P.], seq 469:505, ack 628, win 5849, length 36
22:41:32.721166 IP ubuntu-s-2vcpu-4gb-tor1-01.ssh > d57-134-178-25.home.cgocable.net.49834: Flags [P.], seq 628:664, ack 505, win 4162, length 36
22:41:32.751232 IP d57-134-178-25.home.cgocable.net.49834 > ubuntu-s-2vcpu-4gb-tor1-01.ssh: Flags [P.], seq 505:541, ack 664, win 5849, length 36
22:41:32.751411 IP ubuntu-s-2vcpu-4gb-tor1-01.ssh > d57-134-178-25.home.cgocable.net.49834: Flags [P.], seq 664:700, ack 541, win 4162, length 36
22:41:32.781501 IP d57-134-178-25.home.cgocable.net.49834 > ubuntu-s-2vcpu-4gb-tor1-01.ssh: Flags [P.], seq 541:577, ack 700, win 5848, length 36
22:41:32.781710 IP ubuntu-s-2vcpu-4gb-tor1-01.ssh > d57-134-178-25.home.cgocable.net.49834: Flags [P.], seq 700:736, ack 577, win 4162, length 36
22:41:32.812133 IP d57-134-178-25.home.cgocable.net.49834 > ubuntu-s-2vcpu-4gb-tor1-01.ssh: Flags [P.], seq 577:613, ack 736, win 5848, length 36
22:41:32.812319 IP ubuntu-s-2vcpu-4gb-tor1-01.ssh > d57-134-178-25.home.cgocable.net.49834: Flags [P.], seq 736:772, ack 613, win 4162, length 36
22:41:32.842188 IP d57-134-178-25.home.cgocable.net.49834 > ubuntu-s-2vcpu-4gb-tor1-01.ssh: Flags [P.], seq 613:649, ack 772, win 5848, length 36
22:41:32.842392 IP ubuntu-s-2vcpu-4gb-tor1-01.ssh > d57-134-178-25.home.cgocable.net.49834: Flags [P.], seq 772:808, ack 649, win 4162, length 36
22:41:32.872576 IP d57-134-178-25.home.cgocable.net.49834 > ubuntu-s-2vcpu-4gb-tor1-01.ssh: Flags [P.], seq 649:685, ack 808, win 5848, length 36
22:41:32.872792 IP ubuntu-s-2vcpu-4gb-tor1-01.ssh > d57-134-178-25.home.cgocable.net.49834: Flags [P.], seq 808:844, ack 685, win 4162, length 36
22:41:32.903168 IP d57-134-178-25.home.cgocable.net.49834 > ubuntu-s-2vcpu-4gb-tor1-01.ssh: Flags [P.], seq 685:721, ack 844, win 5848, length 36
22:41:32.903385 IP ubuntu-s-2vcpu-4gb-tor1-01.ssh > d57-134-178-25.home.cgocable.net.49834: Flags [P.], seq 844:880, ack 721, win 4162, length 36
22:41:32.934411 IP d57-134-178-25.home.cgocable.net.49834 > ubuntu-s-2vcpu-4gb-tor1-01.ssh: Flags [P.], seq 721:757, ack 880, win 5848, length 36
22:41:32.934661 IP ubuntu-s-2vcpu-4gb-tor1-01.ssh > d57-134-178-25.home.cgocable.net.49834: Flags [P.], seq 880:916, ack 757, win 4162, length 36
22:41:32.964665 IP d57-134-178-25.home.cgocable.net.49834 > ubuntu-s-2vcpu-4gb-tor1-01.ssh: Flags [P.], seq 757:793, ack 916, win 5848, length 36
22:41:32.964873 IP ubuntu-s-2vcpu-4gb-tor1-01.ssh > d57-134-178-25.home.cgocable.net.49834: Flags [P.], seq 916:952, ack 793, win 4162, length 36
22:41:32.994948 IP d57-134-178-25.home.cgocable.net.49834 > ubuntu-s-2vcpu-4gb-tor1-01.ssh: Flags [P.], seq 793:829, ack 952, win 5847, length 36
22:41:32.995167 IP ubuntu-s-2vcpu-4gb-tor1-01.ssh > d57-134-178-25.home.cgocable.net.49834: Flags [P.], seq 952:988, ack 829, win 4162, length 36
22:41:33.024168 IP d57-134-178-25.home.cgocable.net.49834 > ubuntu-s-2vcpu-4gb-tor1-01.ssh: Flags [P.], seq 829:865, ack 988, win 5847, length 36
22:41:33.024356 IP ubuntu-s-2vcpu-4gb-tor1-01.ssh > d57-134-178-25.home.cgocable.net.49834: Flags [P.], seq 988:1024, ack 865, win 4162, length 36
22:41:33.055494 IP d57-134-178-25.home.cgocable.net.49834 > ubuntu-s-2vcpu-4gb-tor1-01.ssh: Flags [P.], seq 865:901, ack 1024, win 5847, length 36
22:41:33.055721 IP ubuntu-s-2vcpu-4gb-tor1-01.ssh > d57-134-178-25.home.cgocable.net.49834: Flags [P.], seq 1024:1060, ack 901, win 4162, length 36
22:41:33.085760 IP d57-134-178-25.home.cgocable.net.49834 > ubuntu-s-2vcpu-4gb-tor1-01.ssh: Flags [P.], seq 901:937, ack 1060, win 5847, length 36
22:41:33.086008 IP ubuntu-s-2vcpu-4gb-tor1-01.ssh > d57-134-178-25.home.cgocable.net.49834: Flags [P.], seq 1060:1096, ack 937, win 4162, length 36
22:41:33.116041 IP d57-134-178-25.home.cgocable.net.49834 > ubuntu-s-2vcpu-4gb-tor1-01.ssh: Flags [P.], seq 937:973, ack 1096, win 5847, length 36
22:41:33.116221 IP ubuntu-s-2vcpu-4gb-tor1-01.ssh > d57-134-178-25.home.cgocable.net.49834: Flags [P.], seq 1096:1132, ack 973, win 4162, length 36
22:41:33.146643 IP d57-134-178-25.home.cgocable.net.49834 > ubuntu-s-2vcpu-4gb-tor1-01.ssh: Flags [P.], seq 973:1009, ack 1132, win 5847, length 36
22:41:33.146838 IP ubuntu-s-2vcpu-4gb-tor1-01.ssh > d57-134-178-25.home.cgocable.net.49834: Flags [P.], seq 1132:1168, ack 1009, win 4162, length 36
22:41:33.176561 IP d57-134-178-25.home.cgocable.net.49834 > ubuntu-s-2vcpu-4gb-tor1-01.ssh: Flags [P.], seq 1009:1045, ack 1168, win 5847, length 36
22:41:33.176706 IP ubuntu-s-2vcpu-4gb-tor1-01.ssh > d57-134-178-25.home.cgocable.net.49834: Flags [P.], seq 1168:1204, ack 1045, win 4162, length 36
22:41:33.207142 IP d57-134-178-25.home.cgocable.net.49834 > ubuntu-s-2vcpu-4gb-tor1-01.ssh: Flags [P.], seq 1045:1081, ack 1204, win 5846, length 36
22:41:33.207287 IP ubuntu-s-2vcpu-4gb-tor1-01.ssh > d57-134-178-25.home.cgocable.net.49834: Flags [P.], seq 1204:1240, ack 1081, win 4162, length 36
22:41:33.236460 IP d57-134-178-25.home.cgocable.net.49834 > ubuntu-s-2vcpu-4gb-tor1-01.ssh: Flags [P.], seq 1081:1117, ack 1240, win 5846, length 36
22:41:33.236589 IP ubuntu-s-2vcpu-4gb-tor1-01.ssh > d57-134-178-25.home.cgocable.net.49834: Flags [P.], seq 1240:1276, ack 1117, win 4162, length 36
22:41:33.266955 IP d57-134-178-25.home.cgocable.net.49834 > ubuntu-s-2vcpu-4gb-tor1-01.ssh: Flags [P.], seq 1117:1153, ack 1276, win 5846, length 36
22:41:33.267101 IP ubuntu-s-2vcpu-4gb-tor1-01.ssh > d57-134-178-25.home.cgocable.net.49834: Flags [P.], seq 1276:1312, ack 1153, win 4162, length 36
22:41:33.297209 IP d57-134-178-25.home.cgocable.net.49834 > ubuntu-s-2vcpu-4gb-tor1-01.ssh: Flags [P.], seq 1153:1189, ack 1312, win 5846, length 36
22:41:33.297355 IP ubuntu-s-2vcpu-4gb-tor1-01.ssh > d57-134-178-25.home.cgocable.net.49834: Flags [P.], seq 1312:1348, ack 1189, win 4162, length 36
22:41:33.327533 IP d57-134-178-25.home.cgocable.net.49834 > ubuntu-s-2vcpu-4gb-tor1-01.ssh: Flags [P.], seq 1189:1225, ack 1348, win 5846, length 36
22:41:33.327719 IP ubuntu-s-2vcpu-4gb-tor1-01.ssh > d57-134-178-25.home.cgocable.net.49834: Flags [P.], seq 1348:1384, ack 1225, win 4162, length 36
22:41:33.356722 IP d57-134-178-25.home.cgocable.net.49834 > ubuntu-s-2vcpu-4gb-tor1-01.ssh: Flags [P.], seq 1225:1261, ack 1384, win 5846, length 36
22:41:33.356905 IP ubuntu-s-2vcpu-4gb-tor1-01.ssh > d57-134-178-25.home.cgocable.net.49834: Flags [P.], seq 1384:1420, ack 1261, win 4162, length 36
22:41:33.387046 IP d57-134-178-25.home.cgocable.net.49834 > ubuntu-s-2vcpu-4gb-tor1-01.ssh: Flags [P.], seq 1261:1297, ack 1420, win 5846, length 36
22:41:33.387216 IP ubuntu-s-2vcpu-4gb-tor1-01.ssh > d57-134-178-25.home.cgocable.net.49834: Flags [P.], seq 1420:1456, ack 1297, win 4162, length 36
22:41:33.418428 IP d57-134-178-25.home.cgocable.net.49834 > ubuntu-s-2vcpu-4gb-tor1-01.ssh: Flags [P.], seq 1297:1333, ack 1456, win 5845, length 36
22:41:33.418639 IP ubuntu-s-2vcpu-4gb-tor1-01.ssh > d57-134-178-25.home.cgocable.net.49834: Flags [P.], seq 1456:1492, ack 1333, win 4162, length 36
22:41:33.447731 IP d57-134-178-25.home.cgocable.net.49834 > ubuntu-s-2vcpu-4gb-tor1-01.ssh: Flags [P.], seq 1333:1369, ack 1492, win 5845, length 36
22:41:33.447910 IP ubuntu-s-2vcpu-4gb-tor1-01.ssh > d57-134-178-25.home.cgocable.net.49834: Flags [P.], seq 1492:1528, ack 1369, win 4162, length 36
22:41:33.454904 IP 193.34.212.75.39645 > ubuntu-s-2vcpu-4gb-tor1-01.http-alt: Flags [S], seq 4020638388, win 65535, length 0
22:41:33.454938 IP ubuntu-s-2vcpu-4gb-tor1-01.http-alt > 193.34.212.75.39645: Flags [R.], seq 0, ack 4020638389, win 0, length 0
22:41:33.478072 IP d57-134-178-25.home.cgocable.net.49834 > ubuntu-s-2vcpu-4gb-tor1-01.ssh: Flags [P.], seq 1369:1405, ack 1528, win 5851, length 36
22:41:33.478232 IP ubuntu-s-2vcpu-4gb-tor1-01.ssh > d57-134-178-25.home.cgocable.net.49834: Flags [P.], seq 1528:1564, ack 1405, win 4162, length 36
22:41:33.508297 IP d57-134-178-25.home.cgocable.net.49834 > ubuntu-s-2vcpu-4gb-tor1-01.ssh: Flags [P.], seq 1405:1441, ack 1564, win 5851, length 36
22:41:33.508447 IP ubuntu-s-2vcpu-4gb-tor1-01.ssh > d57-134-178-25.home.cgocable.net.49834: Flags [P.], seq 1564:1600, ack 1441, win 4162, length 36
22:41:33.538845 IP d57-134-178-25.home.cgocable.net.49834 > ubuntu-s-2vcpu-4gb-tor1-01.ssh: Flags [P.], seq 1441:1477, ack 1600, win 5851, length 36
22:41:33.539012 IP ubuntu-s-2vcpu-4gb-tor1-01.ssh > d57-134-178-25.home.cgocable.net.49834: Flags [P.], seq 1600:1636, ack 1477, win 4162, length 36
22:41:33.569211 IP d57-134-178-25.home.cgocable.net.49834 > ubuntu-s-2vcpu-4gb-tor1-01.ssh: Flags [P.], seq 1477:1513, ack 1636, win 5850, length 36
22:41:33.569369 IP ubuntu-s-2vcpu-4gb-tor1-01.ssh > d57-134-178-25.home.cgocable.net.49834: Flags [P.], seq 1636:1672, ack 1513, win 4162, length 36
22:41:33.599473 IP d57-134-178-25.home.cgocable.net.49834 > ubuntu-s-2vcpu-4gb-tor1-01.ssh: Flags [P.], seq 1513:1549, ack 1672, win 5850, length 36
22:41:33.599674 IP ubuntu-s-2vcpu-4gb-tor1-01.ssh > d57-134-178-25.home.cgocable.net.49834: Flags [P.], seq 1672:1708, ack 1549, win 4162, length 36
22:41:33.628736 IP d57-134-178-25.home.cgocable.net.49834 > ubuntu-s-2vcpu-4gb-tor1-01.ssh: Flags [P.], seq 1549:1585, ack 1708, win 5850, length 36
22:41:33.628914 IP ubuntu-s-2vcpu-4gb-tor1-01.ssh > d57-134-178-25.home.cgocable.net.49834: Flags [P.], seq 1708:1744, ack 1585, win 4162, length 36
22:41:33.659080 IP d57-134-178-25.home.cgocable.net.49834 > ubuntu-s-2vcpu-4gb-tor1-01.ssh: Flags [P.], seq 1585:1621, ack 1744, win 5850, length 36
22:41:33.659262 IP ubuntu-s-2vcpu-4gb-tor1-01.ssh > d57-134-178-25.home.cgocable.net.49834: Flags [P.], seq 1744:1780, ack 1621, win 4162, length 36
22:41:33.689313 IP d57-134-178-25.home.cgocable.net.49834 > ubuntu-s-2vcpu-4gb-tor1-01.ssh: Flags [P.], seq 1621:1657, ack 1780, win 5850, length 36
22:41:33.689489 IP ubuntu-s-2vcpu-4gb-tor1-01.ssh > d57-134-178-25.home.cgocable.net.49834: Flags [P.], seq 1780:1816, ack 1657, win 4162, length 36
22:41:33.719632 IP d57-134-178-25.home.cgocable.net.49834 > ubuntu-s-2vcpu-4gb-tor1-01.ssh: Flags [P.], seq 1657:1693, ack 1816, win 5850, length 36
22:41:33.719817 IP ubuntu-s-2vcpu-4gb-tor1-01.ssh > d57-134-178-25.home.cgocable.net.49834: Flags [P.], seq 1816:1852, ack 1693, win 4162, length 36
22:41:33.750897 IP d57-134-178-25.home.cgocable.net.49834 > ubuntu-s-2vcpu-4gb-tor1-01.ssh: Flags [P.], seq 1693:1729, ack 1852, win 5850, length 36
22:41:33.751081 IP ubuntu-s-2vcpu-4gb-tor1-01.ssh > d57-134-178-25.home.cgocable.net.49834: Flags [P.], seq 1852:1888, ack 1729, win 4162, length 36
22:41:33.767919 IP 129.18.228.178.48628 > ubuntu-s-2vcpu-4gb-tor1-01.ssh: Flags [P.], seq 232803562:232803630, ack 2220783672, win 501, options [nop,nop,TS val 2734094080 ecr 3998018891], length 68
22:41:33.769529 IP ubuntu-s-2vcpu-4gb-tor1-01.ssh > 129.18.228.178.48628: Flags [P.], seq 1:53, ack 68, win 524, options [nop,nop,TS val 3998029309 ecr 2734094080], length 52
22:41:33.781094 IP d57-134-178-25.home.cgocable.net.49834 > ubuntu-s-2vcpu-4gb-tor1-01.ssh: Flags [P.], seq 1729:1765, ack 1888, win 5850, length 36
22:41:33.781266 IP ubuntu-s-2vcpu-4gb-tor1-01.ssh > d57-134-178-25.home.cgocable.net.49834: Flags [P.], seq 1888:1924, ack 1765, win 4162, length 36
22:41:33.810392 IP d57-134-178-25.home.cgocable.net.49834 > ubuntu-s-2vcpu-4gb-tor1-01.ssh: Flags [P.], seq 1765:1801, ack 1924, win 5849, length 36
22:41:33.810541 IP ubuntu-s-2vcpu-4gb-tor1-01.ssh > d57-134-178-25.home.cgocable.net.49834: Flags [P.], seq 1924:1960, ack 1801, win 4162, length 36
22:41:33.840573 IP d57-134-178-25.home.cgocable.net.49834 > ubuntu-s-2vcpu-4gb-tor1-01.ssh: Flags [P.], seq 1801:1837, ack 1960, win 5849, length 36
22:41:33.840732 IP ubuntu-s-2vcpu-4gb-tor1-01.ssh > d57-134-178-25.home.cgocable.net.49834: Flags [P.], seq 1960:1996, ack 1837, win 4162, length 36
22:41:33.872116 IP d57-134-178-25.home.cgocable.net.49834 > ubuntu-s-2vcpu-4gb-tor1-01.ssh: Flags [P.], seq 1837:1873, ack 1996, win 5849, length 36
22:41:33.872295 IP ubuntu-s-2vcpu-4gb-tor1-01.ssh > d57-134-178-25.home.cgocable.net.49834: Flags [P.], seq 1996:2032, ack 1873, win 4162, length 36
22:41:33.902589 IP d57-134-178-25.home.cgocable.net.49834 > ubuntu-s-2vcpu-4gb-tor1-01.ssh: Flags [P.], seq 1873:1909, ack 2032, win 5849, length 36
22:41:33.902742 IP ubuntu-s-2vcpu-4gb-tor1-01.ssh > d57-134-178-25.home.cgocable.net.49834: Flags [P.], seq 2032:2068, ack 1909, win 4162, length 36
22:41:33.934026 IP d57-134-178-25.home.cgocable.net.49834 > ubuntu-s-2vcpu-4gb-tor1-01.ssh: Flags [P.], seq 1909:1945, ack 2068, win 5849, length 36
22:41:33.934214 IP ubuntu-s-2vcpu-4gb-tor1-01.ssh > d57-134-178-25.home.cgocable.net.49834: Flags [P.], seq 2068:2104, ack 1945, win 4162, length 36
22:41:33.965262 IP d57-134-178-25.home.cgocable.net.49834 > ubuntu-s-2vcpu-4gb-tor1-01.ssh: Flags [P.], seq 1945:1981, ack 2104, win 5849, length 36
22:41:33.965263 IP 129.18.228.178.48628 > ubuntu-s-2vcpu-4gb-tor1-01.ssh: Flags [.], ack 53, win 501, options [nop,nop,TS val 2734094277 ecr 3998029309], length 0
22:41:33.965423 IP ubuntu-s-2vcpu-4gb-tor1-01.ssh > d57-134-178-25.home.cgocable.net.49834: Flags [P.], seq 2104:2140, ack 1981, win 4162, length 36
22:41:33.995028 IP d57-134-178-25.home.cgocable.net.49834 > ubuntu-s-2vcpu-4gb-tor1-01.ssh: Flags [P.], seq 1981:2017, ack 2140, win 5849, length 36
22:41:33.995181 IP ubuntu-s-2vcpu-4gb-tor1-01.ssh > d57-134-178-25.home.cgocable.net.49834: Flags [P.], seq 2140:2176, ack 2017, win 4162, length 36
22:41:34.025932 IP d57-134-178-25.home.cgocable.net.49834 > ubuntu-s-2vcpu-4gb-tor1-01.ssh: Flags [P.], seq 2017:2053, ack 2176, win 5848, length 36
22:41:34.026113 IP ubuntu-s-2vcpu-4gb-tor1-01.ssh > d57-134-178-25.home.cgocable.net.49834: Flags [P.], seq 2176:2212, ack 2053, win 4162, length 36
22:41:34.056041 IP d57-134-178-25.home.cgocable.net.49834 > ubuntu-s-2vcpu-4gb-tor1-01.ssh: Flags [P.], seq 2053:2089, ack 2212, win 5848, length 36
22:41:34.056226 IP ubuntu-s-2vcpu-4gb-tor1-01.ssh > d57-134-178-25.home.cgocable.net.49834: Flags [P.], seq 2212:2248, ack 2089, win 4162, length 36
22:41:34.085954 IP d57-134-178-25.home.cgocable.net.49834 > ubuntu-s-2vcpu-4gb-tor1-01.ssh: Flags [P.], seq 2089:2125, ack 2248, win 5848, length 36
22:41:34.086129 IP ubuntu-s-2vcpu-4gb-tor1-01.ssh > d57-134-178-25.home.cgocable.net.49834: Flags [P.], seq 2248:2284, ack 2125, win 4162, length 36
22:41:34.147396 IP d57-134-178-25.home.cgocable.net.49834 > ubuntu-s-2vcpu-4gb-tor1-01.ssh: Flags [.], ack 2284, win 5848, length 0
22:41:34.828946 IP 100.149.38.185.baremetal.zare.com.52490 > ubuntu-s-2vcpu-4gb-tor1-01.81: Flags [S], seq 136430515, win 65535, options [mss 1460,nop,wscale 8,nop,nop,sackOK], length 0
22:41:34.828998 IP ubuntu-s-2vcpu-4gb-tor1-01.81 > 100.149.38.185.baremetal.zare.com.52490: Flags [R.], seq 0, ack 136430516, win 0, length 0
22:41:34.920350 IP 129.18.228.178.42680 > ubuntu-s-2vcpu-4gb-tor1-01.ssh: Flags [P.], seq 1983170798:1983170882, ack 1905831075, win 501, options [nop,nop,TS val 2734095232 ecr 3998020112], length 84
22:41:34.960663 IP ubuntu-s-2vcpu-4gb-tor1-01.ssh > 129.18.228.178.42680: Flags [.], ack 84, win 524, options [nop,nop,TS val 3998030501 ecr 2734095232], length 0
22:41:35.367354 IP 129.18.228.178.56036 > ubuntu-s-2vcpu-4gb-tor1-01.ssh: Flags [S], seq 74773349, win 64240, options [mss 1460,sackOK,TS val 2734095679 ecr 0,nop,wscale 7], length 0
22:41:35.367394 IP ubuntu-s-2vcpu-4gb-tor1-01.ssh > 129.18.228.178.56036: Flags [S.], seq 916237297, ack 74773350, win 65160, options [mss 1460,sackOK,TS val 3998030907 ecr 2734095679,nop,wscale 7], length 0
22:41:35.562932 IP 129.18.228.178.56036 > ubuntu-s-2vcpu-4gb-tor1-01.ssh: Flags [.], ack 1, win 502, options [nop,nop,TS val 2734095875 ecr 3998030907], length 0
22:41:35.574859 IP ubuntu-s-2vcpu-4gb-tor1-01.ssh > 129.18.228.178.56036: Flags [P.], seq 1:40, ack 1, win 510, options [nop,nop,TS val 3998031115 ecr 2734095875], length 39: SSH: SSH-2.0-OpenSSH_9.7p1 Ubuntu-7ubuntu4
22:41:35.762109 IP 129.18.228.178.43448 > ubuntu-s-2vcpu-4gb-tor1-01.ssh: Flags [P.], seq 611923769:611923781, ack 1885551592, win 502, options [nop,nop,TS val 2734096074 ecr 3998021186], length 12: SSH: SSH-2.0-Go
22:41:35.762155 IP ubuntu-s-2vcpu-4gb-tor1-01.ssh > 129.18.228.178.43448: Flags [.], ack 12, win 510, options [nop,nop,TS val 3998031302 ecr 2734096074], length 0
22:41:35.762165 IP 129.18.228.178.43448 > ubuntu-s-2vcpu-4gb-tor1-01.ssh: Flags [P.], seq 12:1132, ack 1, win 502, options [nop,nop,TS val 2734096074 ecr 3998021186], length 1120
22:41:35.762170 IP ubuntu-s-2vcpu-4gb-tor1-01.ssh > 129.18.228.178.43448: Flags [.], ack 1132, win 524, options [nop,nop,TS val 3998031302 ecr 2734096074], length 0
22:41:35.764142 IP ubuntu-s-2vcpu-4gb-tor1-01.ssh > 129.18.228.178.43448: Flags [P.], seq 1:1121, ack 1132, win 524, options [nop,nop,TS val 3998031304 ecr 2734096074], length 1120
22:41:35.770398 IP 129.18.228.178.56036 > ubuntu-s-2vcpu-4gb-tor1-01.ssh: Flags [.], ack 40, win 502, options [nop,nop,TS val 2734096082 ecr 3998031115], length 0
22:41:35.959958 IP 129.18.228.178.43448 > ubuntu-s-2vcpu-4gb-tor1-01.ssh: Flags [.], ack 1121, win 501, options [nop,nop,TS val 2734096272 ecr 3998031304], length 0
22:41:35.975513 IP 129.18.228.178.49026 > ubuntu-s-2vcpu-4gb-tor1-01.ssh: Flags [P.], seq 866531831:866531879, ack 3458868815, win 501, options [nop,nop,TS val 2734096287 ecr 3998021223], length 48
22:41:35.981162 IP ubuntu-s-2vcpu-4gb-tor1-01.ssh > 129.18.228.178.49026: Flags [P.], seq 1:573, ack 48, win 524, options [nop,nop,TS val 3998031521 ecr 2734096287], length 572
22:41:36.177007 IP 129.18.228.178.49026 > ubuntu-s-2vcpu-4gb-tor1-01.ssh: Flags [.], ack 573, win 501, options [nop,nop,TS val 2734096489 ecr 3998031521], length 0
22:41:36.783817 IP 129.18.228.178.52942 > ubuntu-s-2vcpu-4gb-tor1-01.ssh: Flags [F.], seq 4030329687, ack 3462834170, win 501, options [nop,nop,TS val 2734097096 ecr 3998022129], length 0
22:41:36.785919 IP ubuntu-s-2vcpu-4gb-tor1-01.ssh > 129.18.228.178.52942: Flags [F.], seq 1, ack 1, win 524, options [nop,nop,TS val 3998032326 ecr 2734097096], length 0
22:41:36.981724 IP 129.18.228.178.52942 > ubuntu-s-2vcpu-4gb-tor1-01.ssh: Flags [.], ack 2, win 501, options [nop,nop,TS val 2734097294 ecr 3998032326], length 0
22:41:38.539732 IP ubuntu-s-2vcpu-4gb-tor1-01.ssh > 129.18.228.178.42680: Flags [P.], seq 1:53, ack 84, win 524, options [nop,nop,TS val 3998034080 ecr 2734095232], length 52
22:41:38.735598 IP 129.18.228.178.42680 > ubuntu-s-2vcpu-4gb-tor1-01.ssh: Flags [.], ack 53, win 501, options [nop,nop,TS val 2734099047 ecr 3998034080], length 0
22:41:39.334590 IP 129.18.228.178.49036 > ubuntu-s-2vcpu-4gb-tor1-01.ssh: Flags [P.], seq 1616562605:1616562653, ack 4280655317, win 501, options [nop,nop,TS val 2734099646 ecr 3998024662], length 48
22:41:39.334641 IP ubuntu-s-2vcpu-4gb-tor1-01.ssh > 129.18.228.178.49036: Flags [.], ack 48, win 524, options [nop,nop,TS val 3998034875 ecr 2734099646], length 0
22:41:39.339435 IP ubuntu-s-2vcpu-4gb-tor1-01.ssh > 129.18.228.178.49036: Flags [P.], seq 1:573, ack 48, win 524, options [nop,nop,TS val 3998034879 ecr 2734099646], length 572
22:41:39.534351 IP 129.18.228.178.49036 > ubuntu-s-2vcpu-4gb-tor1-01.ssh: Flags [.], ack 573, win 501, options [nop,nop,TS val 2734099846 ecr 3998034879], length 0
22:41:40.288612 IP 201.7.167.251.55814 > ubuntu-s-2vcpu-4gb-tor1-01.telnet: Flags [S], seq 1975803947, win 29040, options [mss 1420,sackOK,TS val 13774378 ecr 0,nop,wscale 5], length 0
22:41:40.288646 IP ubuntu-s-2vcpu-4gb-tor1-01.telnet > 201.7.167.251.55814: Flags [R.], seq 0, ack 1975803948, win 0, length 0
22:41:41.284627 IP 201.7.167.251.55814 > ubuntu-s-2vcpu-4gb-tor1-01.telnet: Flags [S], seq 1975803947, win 29040, options [mss 1420,sackOK,TS val 13774478 ecr 0,nop,wscale 5], length 0
22:41:41.284660 IP ubuntu-s-2vcpu-4gb-tor1-01.telnet > 201.7.167.251.55814: Flags [R.], seq 0, ack 1, win 0, length 0
22:41:44.410272 IP 129.18.228.178.48628 > ubuntu-s-2vcpu-4gb-tor1-01.ssh: Flags [P.], seq 68:152, ack 53, win 501, options [nop,nop,TS val 2734104722 ecr 3998029309], length 84
22:41:44.450659 IP ubuntu-s-2vcpu-4gb-tor1-01.ssh > 129.18.228.178.48628: Flags [.], ack 152, win 524, options [nop,nop,TS val 3998039991 ecr 2734104722], length 0
22:41:46.109294 IP 129.18.228.178.52558 > ubuntu-s-2vcpu-4gb-tor1-01.ssh: Flags [S], seq 399547494, win 64240, options [mss 1460,sackOK,TS val 2734106421 ecr 0,nop,wscale 7], length 0
22:41:46.109338 IP ubuntu-s-2vcpu-4gb-tor1-01.ssh > 129.18.228.178.52558: Flags [S.], seq 918155380, ack 399547495, win 65160, options [mss 1460,sackOK,TS val 3998041649 ecr 2734106421,nop,wscale 7], length 0
22:41:46.304191 IP 129.18.228.178.52558 > ubuntu-s-2vcpu-4gb-tor1-01.ssh: Flags [.], ack 1, win 502, options [nop,nop,TS val 2734106616 ecr 3998041649], length 0
22:41:46.315703 IP ubuntu-s-2vcpu-4gb-tor1-01.ssh > 129.18.228.178.52558: Flags [P.], seq 1:40, ack 1, win 510, options [nop,nop,TS val 3998041856 ecr 2734106616], length 39: SSH: SSH-2.0-OpenSSH_9.7p1 Ubuntu-7ubuntu4
22:41:46.510565 IP 129.18.228.178.52558 > ubuntu-s-2vcpu-4gb-tor1-01.ssh: Flags [.], ack 40, win 502, options [nop,nop,TS val 2734106822 ecr 3998041856], length 0
22:41:47.746971 IP 129.18.228.178.56036 > ubuntu-s-2vcpu-4gb-tor1-01.ssh: Flags [P.], seq 1:13, ack 40, win 502, options [nop,nop,TS val 2734108059 ecr 3998031115], length 12: SSH: SSH-2.0-Go
22:41:47.747035 IP ubuntu-s-2vcpu-4gb-tor1-01.ssh > 129.18.228.178.56036: Flags [.], ack 13, win 510, options [nop,nop,TS val 3998043287 ecr 2734108059], length 0
22:41:47.747478 IP 129.18.228.178.56036 > ubuntu-s-2vcpu-4gb-tor1-01.ssh: Flags [P.], seq 13:1133, ack 40, win 502, options [nop,nop,TS val 2734108059 ecr 3998031115], length 1120
22:41:47.747499 IP ubuntu-s-2vcpu-4gb-tor1-01.ssh > 129.18.228.178.56036: Flags [.], ack 1133, win 524, options [nop,nop,TS val 3998043287 ecr 2734108059], length 0
22:41:47.749269 IP ubuntu-s-2vcpu-4gb-tor1-01.ssh > 129.18.228.178.56036: Flags [P.], seq 40:1160, ack 1133, win 524, options [nop,nop,TS val 3998043289 ecr 2734108059], length 1120
22:41:47.945018 IP 129.18.228.178.56036 > ubuntu-s-2vcpu-4gb-tor1-01.ssh: Flags [.], ack 1160, win 501, options [nop,nop,TS val 2734108257 ecr 3998043289], length 0
22:41:48.029652 IP ubuntu-s-2vcpu-4gb-tor1-01.ssh > 129.18.228.178.48628: Flags [P.], seq 53:105, ack 152, win 524, options [nop,nop,TS val 3998043570 ecr 2734104722], length 52
22:41:48.225576 IP 129.18.228.178.48628 > ubuntu-s-2vcpu-4gb-tor1-01.ssh: Flags [.], ack 105, win 501, options [nop,nop,TS val 2734108537 ecr 3998043570], length 0
22:41:48.537761 IP 129.18.228.178.43448 > ubuntu-s-2vcpu-4gb-tor1-01.ssh: Flags [P.], seq 1132:1180, ack 1121, win 501, options [nop,nop,TS val 2734108850 ecr 3998031304], length 48
22:41:48.542980 IP ubuntu-s-2vcpu-4gb-tor1-01.ssh > 129.18.228.178.43448: Flags [P.], seq 1121:1693, ack 1180, win 524, options [nop,nop,TS val 3998044083 ecr 2734108850], length 572
22:41:48.738513 IP 129.18.228.178.43448 > ubuntu-s-2vcpu-4gb-tor1-01.ssh: Flags [.], ack 1693, win 501, options [nop,nop,TS val 2734109051 ecr 3998044083], length 0
22:41:48.909433 IP 129.18.228.178.49026 > ubuntu-s-2vcpu-4gb-tor1-01.ssh: Flags [P.], seq 48:64, ack 573, win 501, options [nop,nop,TS val 2734109221 ecr 3998031521], length 16
22:41:48.934683 IP 129.18.228.178.49026 > ubuntu-s-2vcpu-4gb-tor1-01.ssh: Flags [P.], seq 64:116, ack 573, win 501, options [nop,nop,TS val 2734109247 ecr 3998031521], length 52
22:41:48.934799 IP ubuntu-s-2vcpu-4gb-tor1-01.ssh > 129.18.228.178.49026: Flags [.], ack 116, win 524, options [nop,nop,TS val 3998044475 ecr 2734109221], length 0
22:41:48.934877 IP ubuntu-s-2vcpu-4gb-tor1-01.ssh > 129.18.228.178.49026: Flags [P.], seq 573:625, ack 116, win 524, options [nop,nop,TS val 3998044475 ecr 2734109221], length 52
22:41:49.101009 IP 109.205.213.67.41249 > ubuntu-s-2vcpu-4gb-tor1-01.4994: Flags [S], seq 1433704140, win 1024, length 0
22:41:49.101048 IP ubuntu-s-2vcpu-4gb-tor1-01.4994 > 109.205.213.67.41249: Flags [R.], seq 0, ack 1433704141, win 0, length 0
22:41:49.130475 IP 129.18.228.178.49026 > ubuntu-s-2vcpu-4gb-tor1-01.ssh: Flags [.], ack 625, win 501, options [nop,nop,TS val 2734109442 ecr 3998044475], length 0
22:41:49.157347 IP 109.205.213.67.41249 > ubuntu-s-2vcpu-4gb-tor1-01.4994: Flags [R], seq 1433704141, win 1200, length 0
22:41:53.125871 IP 129.18.228.178.42680 > ubuntu-s-2vcpu-4gb-tor1-01.ssh: Flags [F.], seq 84, ack 53, win 501, options [nop,nop,TS val 2734113438 ecr 3998034080], length 0
22:41:53.127491 IP ubuntu-s-2vcpu-4gb-tor1-01.ssh > 129.18.228.178.42680: Flags [F.], seq 53, ack 85, win 524, options [nop,nop,TS val 3998048667 ecr 2734113438], length 0
22:41:53.322992 IP 129.18.228.178.42680 > ubuntu-s-2vcpu-4gb-tor1-01.ssh: Flags [.], ack 54, win 501, options [nop,nop,TS val 2734113635 ecr 3998048667], length 0
22:41:53.799417 IP 129.18.228.178.49036 > ubuntu-s-2vcpu-4gb-tor1-01.ssh: Flags [P.], seq 48:64, ack 573, win 501, options [nop,nop,TS val 2734114111 ecr 3998034879], length 16
22:41:53.799418 IP 129.18.228.178.49036 > ubuntu-s-2vcpu-4gb-tor1-01.ssh: Flags [P.], seq 64:116, ack 573, win 501, options [nop,nop,TS val 2734114111 ecr 3998034879], length 52
22:41:53.799513 IP ubuntu-s-2vcpu-4gb-tor1-01.ssh > 129.18.228.178.49036: Flags [.], ack 116, win 524, options [nop,nop,TS val 3998049339 ecr 2734114111], length 0
22:41:53.799641 IP ubuntu-s-2vcpu-4gb-tor1-01.ssh > 129.18.228.178.49036: Flags [P.], seq 573:625, ack 116, win 524, options [nop,nop,TS val 3998049340 ecr 2734114111], length 52
22:41:53.994276 IP 129.18.228.178.49036 > ubuntu-s-2vcpu-4gb-tor1-01.ssh: Flags [.], ack 625, win 501, options [nop,nop,TS val 2734114306 ecr 3998049340], length 0
22:41:57.583481 IP thebes.scan.bufferover.run.38745 > ubuntu-s-2vcpu-4gb-tor1-01.10134: Flags [S], seq 3934692740, win 65535, options [mss 1460], length 0
22:41:57.583517 IP ubuntu-s-2vcpu-4gb-tor1-01.10134 > thebes.scan.bufferover.run.38745: Flags [R.], seq 0, ack 3934692741, win 0, length 0
22:41:57.807931 IP 129.18.228.178.40248 > ubuntu-s-2vcpu-4gb-tor1-01.ssh: Flags [S], seq 963837786, win 64240, options [mss 1460,sackOK,TS val 2734118116 ecr 0,nop,wscale 7], length 0
22:41:57.807977 IP ubuntu-s-2vcpu-4gb-tor1-01.ssh > 129.18.228.178.40248: Flags [S.], seq 2815478125, ack 963837787, win 65160, options [mss 1460,sackOK,TS val 3998053348 ecr 2734118116,nop,wscale 7], length 0
22:41:58.006465 IP 129.18.228.178.40248 > ubuntu-s-2vcpu-4gb-tor1-01.ssh: Flags [.], ack 1, win 502, options [nop,nop,TS val 2734118315 ecr 3998053348], length 0
22:41:58.018381 IP ubuntu-s-2vcpu-4gb-tor1-01.ssh > 129.18.228.178.40248: Flags [P.], seq 1:40, ack 1, win 510, options [nop,nop,TS val 3998053558 ecr 2734118315], length 39: SSH: SSH-2.0-OpenSSH_9.7p1 Ubuntu-7ubuntu4
22:41:58.217099 IP 129.18.228.178.40248 > ubuntu-s-2vcpu-4gb-tor1-01.ssh: Flags [.], ack 40, win 502, options [nop,nop,TS val 2734118526 ecr 3998053558], length 0
22:41:58.915685 IP 193.41.206.156.36883 > ubuntu-s-2vcpu-4gb-tor1-01.8728: Flags [S], seq 2606193746, win 65535, length 0
22:41:58.915727 IP ubuntu-s-2vcpu-4gb-tor1-01.8728 > 193.41.206.156.36883: Flags [R.], seq 0, ack 2606193747, win 0, length 0
22:41:59.479720 IP 129.18.228.178.52558 > ubuntu-s-2vcpu-4gb-tor1-01.ssh: Flags [P.], seq 1:13, ack 40, win 502, options [nop,nop,TS val 2734119791 ecr 3998041856], length 12: SSH: SSH-2.0-Go
22:41:59.479764 IP ubuntu-s-2vcpu-4gb-tor1-01.ssh > 129.18.228.178.52558: Flags [.], ack 13, win 510, options [nop,nop,TS val 3998055020 ecr 2734119791], length 0
22:41:59.479775 IP 129.18.228.178.52558 > ubuntu-s-2vcpu-4gb-tor1-01.ssh: Flags [P.], seq 13:1133, ack 40, win 502, options [nop,nop,TS val 2734119791 ecr 3998041856], length 1120
22:41:59.479782 IP ubuntu-s-2vcpu-4gb-tor1-01.ssh > 129.18.228.178.52558: Flags [.], ack 1133, win 524, options [nop,nop,TS val 3998055020 ecr 2734119791], length 0
22:41:59.481662 IP ubuntu-s-2vcpu-4gb-tor1-01.ssh > 129.18.228.178.52558: Flags [P.], seq 40:1160, ack 1133, win 524, options [nop,nop,TS val 3998055022 ecr 2734119791], length 1120
22:41:59.676692 IP 129.18.228.178.52558 > ubuntu-s-2vcpu-4gb-tor1-01.ssh: Flags [.], ack 1160, win 501, options [nop,nop,TS val 2734119988 ecr 3998055022], length 0
22:42:00.141072 IP 129.18.228.178.56036 > ubuntu-s-2vcpu-4gb-tor1-01.ssh: Flags [P.], seq 1133:1181, ack 1160, win 501, options [nop,nop,TS val 2734120453 ecr 3998043289], length 48
22:42:00.146516 IP ubuntu-s-2vcpu-4gb-tor1-01.ssh > 129.18.228.178.56036: Flags [P.], seq 1160:1732, ack 1181, win 524, options [nop,nop,TS val 3998055686 ecr 2734120453], length 572
22:42:00.282119 IP 129.18.228.178.48628 > ubuntu-s-2vcpu-4gb-tor1-01.ssh: Flags [F.], seq 152, ack 105, win 501, options [nop,nop,TS val 2734120594 ecr 3998043570], length 0
22:42:00.284530 IP ubuntu-s-2vcpu-4gb-tor1-01.ssh > 129.18.228.178.48628: Flags [F.], seq 105, ack 153, win 524, options [nop,nop,TS val 3998055824 ecr 2734120594], length 0
22:42:00.342097 IP 129.18.228.178.56036 > ubuntu-s-2vcpu-4gb-tor1-01.ssh: Flags [.], ack 1732, win 501, options [nop,nop,TS val 2734120654 ecr 3998055686], length 0
22:42:00.480349 IP 129.18.228.178.48628 > ubuntu-s-2vcpu-4gb-tor1-01.ssh: Flags [.], ack 106, win 501, options [nop,nop,TS val 2734120792 ecr 3998055824], length 0
22:42:00.557994 IP 129.18.228.178.43448 > ubuntu-s-2vcpu-4gb-tor1-01.ssh: Flags [P.], seq 1180:1196, ack 1693, win 501, options [nop,nop,TS val 2734120870 ecr 3998044083], length 16
22:42:00.559181 IP 129.18.228.178.43448 > ubuntu-s-2vcpu-4gb-tor1-01.ssh: Flags [P.], seq 1196:1248, ack 1693, win 501, options [nop,nop,TS val 2734120871 ecr 3998044083], length 52
22:42:00.559259 IP ubuntu-s-2vcpu-4gb-tor1-01.ssh > 129.18.228.178.43448: Flags [.], ack 1248, win 524, options [nop,nop,TS val 3998056099 ecr 2734120870], length 0
22:42:00.559328 IP ubuntu-s-2vcpu-4gb-tor1-01.ssh > 129.18.228.178.43448: Flags [P.], seq 1693:1745, ack 1248, win 524, options [nop,nop,TS val 3998056099 ecr 2734120870], length 52
22:42:00.744206 IP 129.18.228.178.49026 > ubuntu-s-2vcpu-4gb-tor1-01.ssh: Flags [P.], seq 116:184, ack 625, win 501, options [nop,nop,TS val 2734121056 ecr 3998044475], length 68
22:42:00.745550 IP ubuntu-s-2vcpu-4gb-tor1-01.ssh > 129.18.228.178.49026: Flags [P.], seq 625:677, ack 184, win 524, options [nop,nop,TS val 3998056285 ecr 2734121056], length 52
22:42:00.754903 IP 129.18.228.178.43448 > ubuntu-s-2vcpu-4gb-tor1-01.ssh: Flags [.], ack 1745, win 501, options [nop,nop,TS val 2734121067 ecr 3998056099], length 0
22:42:00.941143 IP 129.18.228.178.49026 > ubuntu-s-2vcpu-4gb-tor1-01.ssh: Flags [.], ack 677, win 501, options [nop,nop,TS val 2734121253 ecr 3998056285], length 0
22:42:01.956711 IP 143-42-1-34.ip.linodeusercontent.com.53444 > ubuntu-s-2vcpu-4gb-tor1-01.49153: Flags [S], seq 3207672520, win 65535, options [mss 1460], length 0
22:42:01.956769 IP ubuntu-s-2vcpu-4gb-tor1-01.49153 > 143-42-1-34.ip.linodeusercontent.com.53444: Flags [R.], seq 0, ack 3207672521, win 0, length 0
22:42:03.773229 IP 129.18.228.178.49036 > ubuntu-s-2vcpu-4gb-tor1-01.ssh: Flags [P.], seq 116:184, ack 625, win 501, options [nop,nop,TS val 2734124085 ecr 3998049340], length 68
22:42:03.776037 IP ubuntu-s-2vcpu-4gb-tor1-01.ssh > 129.18.228.178.49036: Flags [P.], seq 625:677, ack 184, win 524, options [nop,nop,TS val 3998059316 ecr 2734124085], length 52
22:42:03.970754 IP 129.18.228.178.49036 > ubuntu-s-2vcpu-4gb-tor1-01.ssh: Flags [.], ack 677, win 501, options [nop,nop,TS val 2734124282 ecr 3998059316], length 0
22:42:05.363895 IP 129.18.228.178.42762 > ubuntu-s-2vcpu-4gb-tor1-01.ssh: Flags [S], seq 4175940619, win 64240, options [mss 1460,sackOK,TS val 2734125676 ecr 0,nop,wscale 7], length 0
22:42:05.363936 IP ubuntu-s-2vcpu-4gb-tor1-01.ssh > 129.18.228.178.42762: Flags [S.], seq 512698550, ack 4175940620, win 65160, options [mss 1460,sackOK,TS val 3998060904 ecr 2734125676,nop,wscale 7], length 0
22:42:05.559598 IP 129.18.228.178.42762 > ubuntu-s-2vcpu-4gb-tor1-01.ssh: Flags [.], ack 1, win 502, options [nop,nop,TS val 2734125871 ecr 3998060904], length 0
22:42:05.571439 IP ubuntu-s-2vcpu-4gb-tor1-01.ssh > 129.18.228.178.42762: Flags [P.], seq 1:40, ack 1, win 510, options [nop,nop,TS val 3998061111 ecr 2734125871], length 39: SSH: SSH-2.0-OpenSSH_9.7p1 Ubuntu-7ubuntu4
22:42:05.767011 IP 129.18.228.178.42762 > ubuntu-s-2vcpu-4gb-tor1-01.ssh: Flags [.], ack 40, win 502, options [nop,nop,TS val 2734126079 ecr 3998061111], length 0
22:42:07.987128 IP 129.18.228.178.40248 > ubuntu-s-2vcpu-4gb-tor1-01.ssh: Flags [P.], seq 1:13, ack 40, win 502, options [nop,nop,TS val 2734128293 ecr 3998053558], length 12: SSH: SSH-2.0-Go
22:42:07.987128 IP 129.18.228.178.40248 > ubuntu-s-2vcpu-4gb-tor1-01.ssh: Flags [P.], seq 13:1133, ack 40, win 502, options [nop,nop,TS val 2734128293 ecr 3998053558], length 1120
22:42:07.987182 IP ubuntu-s-2vcpu-4gb-tor1-01.ssh > 129.18.228.178.40248: Flags [.], ack 13, win 510, options [nop,nop,TS val 3998063527 ecr 2734128293], length 0
22:42:07.987198 IP ubuntu-s-2vcpu-4gb-tor1-01.ssh > 129.18.228.178.40248: Flags [.], ack 1133, win 524, options [nop,nop,TS val 3998063527 ecr 2734128293], length 0
22:42:07.989315 IP ubuntu-s-2vcpu-4gb-tor1-01.ssh > 129.18.228.178.40248: Flags [P.], seq 40:1160, ack 1133, win 524, options [nop,nop,TS val 3998063529 ecr 2734128293], length 1120
22:42:08.187792 IP 129.18.228.178.40248 > ubuntu-s-2vcpu-4gb-tor1-01.ssh: Flags [.], ack 1160, win 501, options [nop,nop,TS val 2734128497 ecr 3998063529], length 0
22:42:09.560740 IP 129.18.228.178.52558 > ubuntu-s-2vcpu-4gb-tor1-01.ssh: Flags [P.], seq 1133:1181, ack 1160, win 501, options [nop,nop,TS val 2734129872 ecr 3998055022], length 48
22:42:09.565884 IP ubuntu-s-2vcpu-4gb-tor1-01.ssh > 129.18.228.178.52558: Flags [P.], seq 1160:1732, ack 1181, win 524, options [nop,nop,TS val 3998065106 ecr 2734129872], length 572
22:42:09.760901 IP 129.18.228.178.52558 > ubuntu-s-2vcpu-4gb-tor1-01.ssh: Flags [.], ack 1732, win 501, options [nop,nop,TS val 2734130072 ecr 3998065106], length 0
22:42:10.186735 IP 129.18.228.178.56036 > ubuntu-s-2vcpu-4gb-tor1-01.ssh: Flags [P.], seq 1181:1197, ack 1732, win 501, options [nop,nop,TS val 2734130499 ecr 3998055686], length 16
22:42:10.203566 IP 129.18.228.178.56036 > ubuntu-s-2vcpu-4gb-tor1-01.ssh: Flags [P.], seq 1197:1249, ack 1732, win 501, options [nop,nop,TS val 2734130515 ecr 3998055686], length 52
22:42:10.203665 IP ubuntu-s-2vcpu-4gb-tor1-01.ssh > 129.18.228.178.56036: Flags [.], ack 1249, win 524, options [nop,nop,TS val 3998065744 ecr 2734130499], length 0
22:42:10.203743 IP ubuntu-s-2vcpu-4gb-tor1-01.ssh > 129.18.228.178.56036: Flags [P.], seq 1732:1784, ack 1249, win 524, options [nop,nop,TS val 3998065744 ecr 2734130499], length 52
22:42:10.399086 IP 129.18.228.178.56036 > ubuntu-s-2vcpu-4gb-tor1-01.ssh: Flags [.], ack 1784, win 501, options [nop,nop,TS val 2734130711 ecr 3998065744], length 0
22:42:10.563682 IP 129.18.228.178.43448 > ubuntu-s-2vcpu-4gb-tor1-01.ssh: Flags [P.], seq 1248:1316, ack 1745, win 501, options [nop,nop,TS val 2734130876 ecr 3998056099], length 68
22:42:10.566290 IP ubuntu-s-2vcpu-4gb-tor1-01.ssh > 129.18.228.178.43448: Flags [P.], seq 1745:1797, ack 1316, win 524, options [nop,nop,TS val 3998066106 ecr 2734130876], length 52
22:42:10.741341 IP 129.18.228.178.49026 > ubuntu-s-2vcpu-4gb-tor1-01.ssh: Flags [P.], seq 184:268, ack 677, win 501, options [nop,nop,TS val 2734131053 ecr 3998056285], length 84
22:42:10.761751 IP 129.18.228.178.43448 > ubuntu-s-2vcpu-4gb-tor1-01.ssh: Flags [.], ack 1797, win 501, options [nop,nop,TS val 2734131074 ecr 3998066106], length 0
22:42:10.787667 IP ubuntu-s-2vcpu-4gb-tor1-01.ssh > 129.18.228.178.49026: Flags [.], ack 268, win 524, options [nop,nop,TS val 3998066328 ecr 2734131053], length 0
22:42:13.753561 IP 129.18.228.178.49036 > ubuntu-s-2vcpu-4gb-tor1-01.ssh: Flags [P.], seq 184:268, ack 677, win 501, options [nop,nop,TS val 2734134065 ecr 3998059316], length 84
22:42:13.793659 IP ubuntu-s-2vcpu-4gb-tor1-01.ssh > 129.18.228.178.49036: Flags [.], ack 268, win 524, options [nop,nop,TS val 3998069334 ecr 2734134065], length 0
22:42:14.360751 IP ubuntu-s-2vcpu-4gb-tor1-01.ssh > 129.18.228.178.49026: Flags [P.], seq 677:729, ack 268, win 524, options [nop,nop,TS val 3998069901 ecr 2734131053], length 52
22:42:14.556314 IP 129.18.228.178.49026 > ubuntu-s-2vcpu-4gb-tor1-01.ssh: Flags [.], ack 729, win 501, options [nop,nop,TS val 2734134868 ecr 3998069901], length 0
22:42:15.756620 IP 129.18.228.178.42762 > ubuntu-s-2vcpu-4gb-tor1-01.ssh: Flags [P.], seq 1:13, ack 40, win 502, options [nop,nop,TS val 2734136069 ecr 3998061111], length 12: SSH: SSH-2.0-Go
22:42:15.756664 IP ubuntu-s-2vcpu-4gb-tor1-01.ssh > 129.18.228.178.42762: Flags [.], ack 13, win 510, options [nop,nop,TS val 3998071297 ecr 2734136069], length 0
22:42:15.756887 IP 129.18.228.178.42762 > ubuntu-s-2vcpu-4gb-tor1-01.ssh: Flags [P.], seq 13:1133, ack 40, win 502, options [nop,nop,TS val 2734136069 ecr 3998061111], length 1120
22:42:15.756894 IP ubuntu-s-2vcpu-4gb-tor1-01.ssh > 129.18.228.178.42762: Flags [.], ack 1133, win 524, options [nop,nop,TS val 3998071297 ecr 2734136069], length 0
22:42:15.758428 IP ubuntu-s-2vcpu-4gb-tor1-01.ssh > 129.18.228.178.42762: Flags [P.], seq 40:1160, ack 1133, win 524, options [nop,nop,TS val 3998071298 ecr 2734136069], length 1120
22:42:15.954279 IP 129.18.228.178.42762 > ubuntu-s-2vcpu-4gb-tor1-01.ssh: Flags [.], ack 1160, win 501, options [nop,nop,TS val 2734136266 ecr 3998071298], length 0
22:42:17.125009 IP 129.18.228.178.48884 > ubuntu-s-2vcpu-4gb-tor1-01.ssh: Flags [S], seq 3810684821, win 64240, options [mss 1460,sackOK,TS val 2734137439 ecr 0,nop,wscale 7], length 0
22:42:17.125051 IP ubuntu-s-2vcpu-4gb-tor1-01.ssh > 129.18.228.178.48884: Flags [S.], seq 1782228349, ack 3810684822, win 65160, options [mss 1460,sackOK,TS val 3998072665 ecr 2734137439,nop,wscale 7], length 0
22:42:17.144703 IP ubuntu-s-2vcpu-4gb-tor1-01.ssh > 129.18.228.178.49036: Flags [P.], seq 677:729, ack 268, win 524, options [nop,nop,TS val 3998072685 ecr 2734134065], length 52
22:42:17.317326 IP 129.18.228.178.48884 > ubuntu-s-2vcpu-4gb-tor1-01.ssh: Flags [.], ack 1, win 502, options [nop,nop,TS val 2734137631 ecr 3998072665], length 0
22:42:17.328351 IP ubuntu-s-2vcpu-4gb-tor1-01.ssh > 129.18.228.178.48884: Flags [P.], seq 1:40, ack 1, win 510, options [nop,nop,TS val 3998072868 ecr 2734137631], length 39: SSH: SSH-2.0-OpenSSH_9.7p1 Ubuntu-7ubuntu4
22:42:17.339620 IP 129.18.228.178.49036 > ubuntu-s-2vcpu-4gb-tor1-01.ssh: Flags [.], ack 729, win 501, options [nop,nop,TS val 2734137651 ecr 3998072685], length 0
22:42:17.520721 IP 129.18.228.178.48884 > ubuntu-s-2vcpu-4gb-tor1-01.ssh: Flags [.], ack 40, win 502, options [nop,nop,TS val 2734137835 ecr 3998072868], length 0
22:42:18.518996 IP 129.18.228.178.40248 > ubuntu-s-2vcpu-4gb-tor1-01.ssh: Flags [P.], seq 1133:1181, ack 1160, win 501, options [nop,nop,TS val 2734138828 ecr 3998063529], length 48
22:42:18.524478 IP ubuntu-s-2vcpu-4gb-tor1-01.ssh > 129.18.228.178.40248: Flags [P.], seq 1160:1732, ack 1181, win 524, options [nop,nop,TS val 3998074064 ecr 2734138828], length 572
22:42:18.723280 IP 129.18.228.178.40248 > ubuntu-s-2vcpu-4gb-tor1-01.ssh: Flags [.], ack 1732, win 501, options [nop,nop,TS val 2734139032 ecr 3998074064], length 0
22:42:19.170998 IP 198.235.24.113.62790 > ubuntu-s-2vcpu-4gb-tor1-01.ssh: Flags [S], seq 28204665, win 65320, options [mss 1420,sackOK,TS val 2681974930 ecr 0,nop,wscale 7], length 0
22:42:19.171049 IP ubuntu-s-2vcpu-4gb-tor1-01.ssh > 198.235.24.113.62790: Flags [S.], seq 866902127, ack 28204666, win 65160, options [mss 1460,sackOK,TS val 668042490 ecr 2681974930,nop,wscale 7], length 0
22:42:19.360211 IP 198.235.24.113.62790 > ubuntu-s-2vcpu-4gb-tor1-01.ssh: Flags [.], ack 1, win 511, options [nop,nop,TS val 2681975120 ecr 668042490], length 0
22:42:19.372931 IP ubuntu-s-2vcpu-4gb-tor1-01.ssh > 198.235.24.113.62790: Flags [P.], seq 1:40, ack 1, win 510, options [nop,nop,TS val 668042692 ecr 2681975120], length 39: SSH: SSH-2.0-OpenSSH_9.7p1 Ubuntu-7ubuntu4
22:42:19.561670 IP 198.235.24.113.62790 > ubuntu-s-2vcpu-4gb-tor1-01.ssh: Flags [.], ack 40, win 511, options [nop,nop,TS val 2681975321 ecr 668042692], length 0
22:42:19.580773 IP vmi907521.contaboserver.net.61234 > ubuntu-s-2vcpu-4gb-tor1-01.5908: Flags [S], seq 1850875519, win 1024, length 0
22:42:19.580814 IP ubuntu-s-2vcpu-4gb-tor1-01.5908 > vmi907521.contaboserver.net.61234: Flags [R.], seq 0, ack 1850875520, win 0, length 0
22:42:20.085771 IP 198.235.24.113.62790 > ubuntu-s-2vcpu-4gb-tor1-01.ssh: Flags [P.], seq 1:33, ack 40, win 511, options [nop,nop,TS val 2681975846 ecr 668042692], length 32: SSH: SSH-2.0-ZGrab ZGrab SSH Survey
22:42:20.085815 IP ubuntu-s-2vcpu-4gb-tor1-01.ssh > 198.235.24.113.62790: Flags [.], ack 33, win 510, options [nop,nop,TS val 668043405 ecr 2681975846], length 0
22:42:20.087533 IP ubuntu-s-2vcpu-4gb-tor1-01.ssh > 198.235.24.113.62790: Flags [P.], seq 40:1160, ack 33, win 510, options [nop,nop,TS val 668043406 ecr 2681975846], length 1120
22:42:20.221286 IP 129.18.228.178.52558 > ubuntu-s-2vcpu-4gb-tor1-01.ssh: Flags [P.], seq 1181:1197, ack 1732, win 501, options [nop,nop,TS val 2734140532 ecr 3998065106], length 16
22:42:20.221287 IP 129.18.228.178.52558 > ubuntu-s-2vcpu-4gb-tor1-01.ssh: Flags [P.], seq 1197:1249, ack 1732, win 501, options [nop,nop,TS val 2734140533 ecr 3998065106], length 52
22:42:20.221408 IP ubuntu-s-2vcpu-4gb-tor1-01.ssh > 129.18.228.178.52558: Flags [.], ack 1249, win 524, options [nop,nop,TS val 3998075761 ecr 2734140532], length 0
22:42:20.221538 IP ubuntu-s-2vcpu-4gb-tor1-01.ssh > 129.18.228.178.52558: Flags [P.], seq 1732:1784, ack 1249, win 524, options [nop,nop,TS val 3998075761 ecr 2734140532], length 52
22:42:20.276144 IP 198.235.24.113.62790 > ubuntu-s-2vcpu-4gb-tor1-01.ssh: Flags [.], ack 1160, win 503, options [nop,nop,TS val 2681976036 ecr 668043406], length 0
22:42:20.416530 IP 129.18.228.178.52558 > ubuntu-s-2vcpu-4gb-tor1-01.ssh: Flags [.], ack 1784, win 501, options [nop,nop,TS val 2734140728 ecr 3998075761], length 0
22:42:20.925585 IP 129.18.228.178.56036 > ubuntu-s-2vcpu-4gb-tor1-01.ssh: Flags [P.], seq 1249:1317, ack 1784, win 501, options [nop,nop,TS val 2734141238 ecr 3998065744], length 68
22:42:20.928226 IP ubuntu-s-2vcpu-4gb-tor1-01.ssh > 129.18.228.178.56036: Flags [P.], seq 1784:1836, ack 1317, win 524, options [nop,nop,TS val 3998076468 ecr 2734141238], length 52
22:42:21.001098 IP 198.235.24.113.62790 > ubuntu-s-2vcpu-4gb-tor1-01.ssh: Flags [P.], seq 33:1913, ack 1160, win 503, options [nop,nop,TS val 2681976761 ecr 668043406], length 1880
22:42:21.001154 IP 198.235.24.113.62790 > ubuntu-s-2vcpu-4gb-tor1-01.ssh: Flags [P.], seq 1913:1937, ack 1160, win 503, options [nop,nop,TS val 2681976761 ecr 668043406], length 24
22:42:21.001225 IP ubuntu-s-2vcpu-4gb-tor1-01.ssh > 198.235.24.113.62790: Flags [.], ack 1937, win 496, options [nop,nop,TS val 668044320 ecr 2681976761], length 0
22:42:21.009204 IP ubuntu-s-2vcpu-4gb-tor1-01.ssh > 198.235.24.113.62790: Flags [P.], seq 1160:1568, ack 1937, win 496, options [nop,nop,TS val 668044328 ecr 2681976761], length 408
22:42:21.123743 IP 129.18.228.178.56036 > ubuntu-s-2vcpu-4gb-tor1-01.ssh: Flags [.], ack 1836, win 501, options [nop,nop,TS val 2734141436 ecr 3998076468], length 0
22:42:21.197888 IP 198.235.24.113.62790 > ubuntu-s-2vcpu-4gb-tor1-01.ssh: Flags [.], ack 1568, win 501, options [nop,nop,TS val 2681976958 ecr 668044328], length 0
22:42:21.364538 IP 129.18.228.178.43448 > ubuntu-s-2vcpu-4gb-tor1-01.ssh: Flags [P.], seq 1316:1400, ack 1797, win 501, options [nop,nop,TS val 2734141676 ecr 3998066106], length 84
22:42:21.404669 IP ubuntu-s-2vcpu-4gb-tor1-01.ssh > 129.18.228.178.43448: Flags [.], ack 1400, win 524, options [nop,nop,TS val 3998076945 ecr 2734141676], length 0
22:42:21.830569 IP 198.235.24.113.62790 > ubuntu-s-2vcpu-4gb-tor1-01.ssh: Flags [P.], seq 1937:2337, ack 1568, win 501, options [nop,nop,TS val 2681977590 ecr 668044328], length 400
22:42:21.833306 IP ubuntu-s-2vcpu-4gb-tor1-01.ssh > 198.235.24.113.62790: Flags [P.], seq 1568:2200, ack 2337, win 493, options [nop,nop,TS val 668045152 ecr 2681977590], length 632
22:42:22.021963 IP 198.235.24.113.62790 > ubuntu-s-2vcpu-4gb-tor1-01.ssh: Flags [.], ack 2200, win 501, options [nop,nop,TS val 2681977782 ecr 668045152], length 0
22:42:22.823088 IP 198.235.24.113.62790 > ubuntu-s-2vcpu-4gb-tor1-01.ssh: Flags [R.], seq 2337, ack 2200, win 501, options [nop,nop,TS val 2681978583 ecr 668045152], length 0
22:42:23.171536 IP 129.18.228.178.39280 > ubuntu-s-2vcpu-4gb-tor1-01.ssh: Flags [S], seq 3069971214, win 64240, options [mss 1460,sackOK,TS val 2734143483 ecr 0,nop,wscale 7], length 0
22:42:23.171573 IP ubuntu-s-2vcpu-4gb-tor1-01.ssh > 129.18.228.178.39280: Flags [S.], seq 881957972, ack 3069971215, win 65160, options [mss 1460,sackOK,TS val 3998078711 ecr 2734143483,nop,wscale 7], length 0
22:42:23.367146 IP 129.18.228.178.39280 > ubuntu-s-2vcpu-4gb-tor1-01.ssh: Flags [.], ack 1, win 502, options [nop,nop,TS val 2734143679 ecr 3998078711], length 0
22:42:23.396510 IP ubuntu-s-2vcpu-4gb-tor1-01.ssh > 129.18.228.178.39280: Flags [P.], seq 1:40, ack 1, win 510, options [nop,nop,TS val 3998078936 ecr 2734143679], length 39: SSH: SSH-2.0-OpenSSH_9.7p1 Ubuntu-7ubuntu4
22:42:23.592088 IP 129.18.228.178.39280 > ubuntu-s-2vcpu-4gb-tor1-01.ssh: Flags [.], ack 40, win 502, options [nop,nop,TS val 2734143904 ecr 3998078936], length 0
22:42:25.081636 IP 129.18.228.178.49026 > ubuntu-s-2vcpu-4gb-tor1-01.ssh: Flags [F.], seq 268, ack 729, win 501, options [nop,nop,TS val 2734145393 ecr 3998069901], length 0
22:42:25.083452 IP ubuntu-s-2vcpu-4gb-tor1-01.ssh > 129.18.228.178.49026: Flags [F.], seq 729, ack 269, win 524, options [nop,nop,TS val 3998080623 ecr 2734145393], length 0
22:42:25.279004 IP 129.18.228.178.49026 > ubuntu-s-2vcpu-4gb-tor1-01.ssh: Flags [.], ack 730, win 501, options [nop,nop,TS val 2734145591 ecr 3998080623], length 0
22:42:25.311694 IP ubuntu-s-2vcpu-4gb-tor1-01.ssh > 129.18.228.178.43448: Flags [P.], seq 1797:1849, ack 1400, win 524, options [nop,nop,TS val 3998080852 ecr 2734141676], length 52
22:42:25.367770 IP 103.102.230.6.40345 > ubuntu-s-2vcpu-4gb-tor1-01.8728: Flags [S], seq 4123596113, win 65535, length 0
22:42:25.367804 IP ubuntu-s-2vcpu-4gb-tor1-01.8728 > 103.102.230.6.40345: Flags [R.], seq 0, ack 4123596114, win 0, length 0
22:42:25.507657 IP 129.18.228.178.43448 > ubuntu-s-2vcpu-4gb-tor1-01.ssh: Flags [.], ack 1849, win 501, options [nop,nop,TS val 2734145819 ecr 3998080852], length 0
22:42:28.132394 IP 129.18.228.178.42762 > ubuntu-s-2vcpu-4gb-tor1-01.ssh: Flags [P.], seq 1133:1181, ack 1160, win 501, options [nop,nop,TS val 2734148444 ecr 3998071298], length 48
22:42:28.140200 IP ubuntu-s-2vcpu-4gb-tor1-01.ssh > 129.18.228.178.42762: Flags [P.], seq 1160:1732, ack 1181, win 524, options [nop,nop,TS val 3998083680 ecr 2734148444], length 572
22:42:28.335857 IP 129.18.228.178.42762 > ubuntu-s-2vcpu-4gb-tor1-01.ssh: Flags [.], ack 1732, win 501, options [nop,nop,TS val 2734148648 ecr 3998083680], length 0
22:42:30.625630 IP 129.18.228.178.48884 > ubuntu-s-2vcpu-4gb-tor1-01.ssh: Flags [P.], seq 1:13, ack 40, win 502, options [nop,nop,TS val 2734150940 ecr 3998072868], length 12: SSH: SSH-2.0-Go
22:42:30.625678 IP ubuntu-s-2vcpu-4gb-tor1-01.ssh > 129.18.228.178.48884: Flags [.], ack 13, win 510, options [nop,nop,TS val 3998086166 ecr 2734150940], length 0
22:42:30.627305 IP ubuntu-s-2vcpu-4gb-tor1-01.ssh > 129.18.228.178.48884: Flags [P.], seq 40:1160, ack 13, win 510, options [nop,nop,TS val 3998086167 ecr 2734150940], length 1120
22:42:30.666747 IP 129.18.228.178.49036 > ubuntu-s-2vcpu-4gb-tor1-01.ssh: Flags [F.], seq 268, ack 729, win 501, options [nop,nop,TS val 2734150978 ecr 3998072685], length 0
22:42:30.668256 IP ubuntu-s-2vcpu-4gb-tor1-01.ssh > 129.18.228.178.49036: Flags [F.], seq 729, ack 269, win 524, options [nop,nop,TS val 3998086208 ecr 2734150978], length 0
22:42:30.817947 IP 129.18.228.178.48884 > ubuntu-s-2vcpu-4gb-tor1-01.ssh: Flags [P.], seq 13:1133, ack 40, win 502, options [nop,nop,TS val 2734151132 ecr 3998086166], length 1120
22:42:30.819888 IP 129.18.228.178.48884 > ubuntu-s-2vcpu-4gb-tor1-01.ssh: Flags [.], ack 1160, win 501, options [nop,nop,TS val 2734151134 ecr 3998086167], length 0
22:42:30.858657 IP ubuntu-s-2vcpu-4gb-tor1-01.ssh > 129.18.228.178.48884: Flags [.], ack 1133, win 524, options [nop,nop,TS val 3998086399 ecr 2734151132], length 0
22:42:30.863071 IP 129.18.228.178.49036 > ubuntu-s-2vcpu-4gb-tor1-01.ssh: Flags [.], ack 730, win 501, options [nop,nop,TS val 2734151175 ecr 3998086208], length 0
22:42:33.204567 IP 129.18.228.178.40248 > ubuntu-s-2vcpu-4gb-tor1-01.ssh: Flags [P.], seq 1181:1197, ack 1732, win 501, options [nop,nop,TS val 2734153513 ecr 3998074064], length 16
22:42:33.214386 IP 129.18.228.178.40248 > ubuntu-s-2vcpu-4gb-tor1-01.ssh: Flags [P.], seq 1197:1249, ack 1732, win 501, options [nop,nop,TS val 2734153523 ecr 3998074064], length 52
22:42:33.214487 IP ubuntu-s-2vcpu-4gb-tor1-01.ssh > 129.18.228.178.40248: Flags [.], ack 1249, win 524, options [nop,nop,TS val 3998088754 ecr 2734153513], length 0
22:42:33.214560 IP ubuntu-s-2vcpu-4gb-tor1-01.ssh > 129.18.228.178.40248: Flags [P.], seq 1732:1784, ack 1249, win 524, options [nop,nop,TS val 3998088754 ecr 2734153513], length 52
22:42:33.412951 IP 129.18.228.178.40248 > ubuntu-s-2vcpu-4gb-tor1-01.ssh: Flags [.], ack 1784, win 501, options [nop,nop,TS val 2734153722 ecr 3998088754], length 0
22:42:34.644655 IP 129.18.228.178.52558 > ubuntu-s-2vcpu-4gb-tor1-01.ssh: Flags [P.], seq 1249:1317, ack 1784, win 501, options [nop,nop,TS val 2734154938 ecr 3998075761], length 68
22:42:34.647230 IP ubuntu-s-2vcpu-4gb-tor1-01.ssh > 129.18.228.178.52558: Flags [P.], seq 1784:1836, ack 1317, win 524, options [nop,nop,TS val 3998090187 ecr 2734154938], length 52
22:42:34.842202 IP 129.18.228.178.52558 > ubuntu-s-2vcpu-4gb-tor1-01.ssh: Flags [.], ack 1836, win 501, options [nop,nop,TS val 2734155154 ecr 3998090187], length 0
22:42:35.279765 IP 129.18.228.178.56036 > ubuntu-s-2vcpu-4gb-tor1-01.ssh: Flags [P.], seq 1317:1401, ack 1836, win 501, options [nop,nop,TS val 2734155592 ecr 3998076468], length 84
22:42:35.320656 IP ubuntu-s-2vcpu-4gb-tor1-01.ssh > 129.18.228.178.56036: Flags [.], ack 1401, win 524, options [nop,nop,TS val 3998090861 ecr 2734155592], length 0
22:42:37.338053 IP 129.18.228.178.39280 > ubuntu-s-2vcpu-4gb-tor1-01.ssh: Flags [P.], seq 1:13, ack 40, win 502, options [nop,nop,TS val 2734157650 ecr 3998078936], length 12: SSH: SSH-2.0-Go
22:42:37.338102 IP ubuntu-s-2vcpu-4gb-tor1-01.ssh > 129.18.228.178.39280: Flags [.], ack 13, win 510, options [nop,nop,TS val 3998092878 ecr 2734157650], length 0
22:42:37.339838 IP ubuntu-s-2vcpu-4gb-tor1-01.ssh > 129.18.228.178.39280: Flags [P.], seq 40:1160, ack 13, win 510, options [nop,nop,TS val 3998092880 ecr 2734157650], length 1120
22:42:37.343914 IP 129.18.228.178.39280 > ubuntu-s-2vcpu-4gb-tor1-01.ssh: Flags [P.], seq 13:1133, ack 40, win 502, options [nop,nop,TS val 2734157655 ecr 3998078936], length 1120
22:42:37.384683 IP ubuntu-s-2vcpu-4gb-tor1-01.ssh > 129.18.228.178.39280: Flags [.], ack 1133, win 524, options [nop,nop,TS val 3998092925 ecr 2734157655], length 0
22:42:37.425533 IP ubuntu-s-2vcpu-4gb-tor1-01.ssh > 129.18.228.178.56036: Flags [P.], seq 1836:1888, ack 1401, win 524, options [nop,nop,TS val 3998092965 ecr 2734155592], length 52
22:42:37.535457 IP 129.18.228.178.39280 > ubuntu-s-2vcpu-4gb-tor1-01.ssh: Flags [.], ack 1160, win 501, options [nop,nop,TS val 2734157847 ecr 3998092880], length 0
22:42:37.621075 IP 129.18.228.178.56036 > ubuntu-s-2vcpu-4gb-tor1-01.ssh: Flags [.], ack 1888, win 501, options [nop,nop,TS val 2734157933 ecr 3998092965], length 0
22:42:37.731121 IP 129.18.228.178.59240 > ubuntu-s-2vcpu-4gb-tor1-01.ssh: Flags [S], seq 1149135080, win 64240, options [mss 1460,sackOK,TS val 2734158043 ecr 0,nop,wscale 7], length 0
22:42:37.731183 IP ubuntu-s-2vcpu-4gb-tor1-01.ssh > 129.18.228.178.59240: Flags [S.], seq 2737996189, ack 1149135081, win 65160, options [mss 1460,sackOK,TS val 3998093271 ecr 2734158043,nop,wscale 7], length 0
22:42:37.926839 IP 129.18.228.178.59240 > ubuntu-s-2vcpu-4gb-tor1-01.ssh: Flags [.], ack 1, win 502, options [nop,nop,TS val 2734158239 ecr 3998093271], length 0
22:42:37.937964 IP ubuntu-s-2vcpu-4gb-tor1-01.ssh > 129.18.228.178.59240: Flags [P.], seq 1:40, ack 1, win 510, options [nop,nop,TS val 3998093478 ecr 2734158239], length 39: SSH: SSH-2.0-OpenSSH_9.7p1 Ubuntu-7ubuntu4
22:42:38.133448 IP 129.18.228.178.59240 > ubuntu-s-2vcpu-4gb-tor1-01.ssh: Flags [.], ack 40, win 502, options [nop,nop,TS val 2734158445 ecr 3998093478], length 0
22:42:38.570966 IP 198.235.24.143.52922 > ubuntu-s-2vcpu-4gb-tor1-01.ssh: Flags [S], seq 1338406095, win 1024, options [mss 1460], length 0
22:42:38.571005 IP ubuntu-s-2vcpu-4gb-tor1-01.ssh > 198.235.24.143.52922: Flags [S.], seq 3619800115, ack 1338406096, win 64240, options [mss 1460], length 0
22:42:38.719064 IP 198.235.24.143.52922 > ubuntu-s-2vcpu-4gb-tor1-01.ssh: Flags [.], ack 1, win 1200, options [mss 1460], length 0
22:42:38.730374 IP ubuntu-s-2vcpu-4gb-tor1-01.ssh > 198.235.24.143.52922: Flags [P.], seq 1:40, ack 1, win 64240, length 39: SSH: SSH-2.0-OpenSSH_9.7p1 Ubuntu-7ubuntu4
22:42:38.797121 IP 94.232.47.83.56733 > ubuntu-s-2vcpu-4gb-tor1-01.40443: Flags [S], seq 1119735505, win 1025, options [mss 1460], length 0
22:42:38.797164 IP ubuntu-s-2vcpu-4gb-tor1-01.40443 > 94.232.47.83.56733: Flags [R.], seq 0, ack 1119735506, win 0, length 0
22:42:38.871659 IP 198.235.24.143.52922 > ubuntu-s-2vcpu-4gb-tor1-01.ssh: Flags [.], ack 40, win 1200, options [mss 1460], length 0
22:42:38.871660 IP 198.235.24.143.52922 > ubuntu-s-2vcpu-4gb-tor1-01.ssh: Flags [F.], seq 1, ack 40, win 1200, options [mss 1460], length 0
22:42:38.872381 IP ubuntu-s-2vcpu-4gb-tor1-01.ssh > 198.235.24.143.52922: Flags [F.], seq 40, ack 2, win 64239, length 0
22:42:38.930713 IP 94.232.47.83.56733 > ubuntu-s-2vcpu-4gb-tor1-01.40443: Flags [R], seq 1119735506, win 1200, options [mss 1460], length 0
22:42:39.037661 IP 198.235.24.143.52922 > ubuntu-s-2vcpu-4gb-tor1-01.ssh: Flags [F.], seq 2, ack 41, win 1200, options [mss 1460], length 0
22:42:39.370482 IP 129.18.228.178.43448 > ubuntu-s-2vcpu-4gb-tor1-01.ssh: Flags [F.], seq 1400, ack 1849, win 501, options [nop,nop,TS val 2734159682 ecr 3998080852], length 0
22:42:39.372093 IP ubuntu-s-2vcpu-4gb-tor1-01.ssh > 129.18.228.178.43448: Flags [F.], seq 1849, ack 1401, win 524, options [nop,nop,TS val 3998094912 ecr 2734159682], length 0
22:42:39.567952 IP 129.18.228.178.43448 > ubuntu-s-2vcpu-4gb-tor1-01.ssh: Flags [.], ack 1850, win 501, options [nop,nop,TS val 2734159880 ecr 3998094912], length 0
22:42:40.591364 IP 129.18.228.178.42762 > ubuntu-s-2vcpu-4gb-tor1-01.ssh: Flags [P.], seq 1181:1197, ack 1732, win 501, options [nop,nop,TS val 2734160903 ecr 3998083680], length 16
22:42:40.591364 IP 129.18.228.178.42762 > ubuntu-s-2vcpu-4gb-tor1-01.ssh: Flags [P.], seq 1197:1249, ack 1732, win 501, options [nop,nop,TS val 2734160903 ecr 3998083680], length 52
22:42:40.591463 IP ubuntu-s-2vcpu-4gb-tor1-01.ssh > 129.18.228.178.42762: Flags [.], ack 1249, win 524, options [nop,nop,TS val 3998096131 ecr 2734160903], length 0
22:42:40.591567 IP ubuntu-s-2vcpu-4gb-tor1-01.ssh > 129.18.228.178.42762: Flags [P.], seq 1732:1784, ack 1249, win 524, options [nop,nop,TS val 3998096131 ecr 2734160903], length 52
22:42:40.787147 IP 129.18.228.178.42762 > ubuntu-s-2vcpu-4gb-tor1-01.ssh: Flags [.], ack 1784, win 501, options [nop,nop,TS val 2734161099 ecr 3998096131], length 0
22:42:41.830076 IP 129.18.228.178.48884 > ubuntu-s-2vcpu-4gb-tor1-01.ssh: Flags [P.], seq 1133:1181, ack 1160, win 501, options [nop,nop,TS val 2734162144 ecr 3998086399], length 48
22:42:41.830124 IP ubuntu-s-2vcpu-4gb-tor1-01.ssh > 129.18.228.178.48884: Flags [.], ack 1181, win 524, options [nop,nop,TS val 3998097370 ecr 2734162144], length 0
22:42:41.834920 IP ubuntu-s-2vcpu-4gb-tor1-01.ssh > 129.18.228.178.48884: Flags [P.], seq 1160:1732, ack 1181, win 524, options [nop,nop,TS val 3998097375 ecr 2734162144], length 572
22:42:42.027100 IP 129.18.228.178.48884 > ubuntu-s-2vcpu-4gb-tor1-01.ssh: Flags [.], ack 1732, win 501, options [nop,nop,TS val 2734162341 ecr 3998097375], length 0
22:42:43.175146 IP 129.18.228.178.40248 > ubuntu-s-2vcpu-4gb-tor1-01.ssh: Flags [P.], seq 1249:1317, ack 1784, win 501, options [nop,nop,TS val 2734163484 ecr 3998088754], length 68
22:42:43.176497 IP ubuntu-s-2vcpu-4gb-tor1-01.ssh > 129.18.228.178.40248: Flags [P.], seq 1784:1836, ack 1317, win 524, options [nop,nop,TS val 3998098716 ecr 2734163484], length 52
22:42:43.375065 IP 129.18.228.178.40248 > ubuntu-s-2vcpu-4gb-tor1-01.ssh: Flags [.], ack 1836, win 501, options [nop,nop,TS val 2734163684 ecr 3998098716], length 0
22:42:44.557668 IP 129.18.228.178.52558 > ubuntu-s-2vcpu-4gb-tor1-01.ssh: Flags [P.], seq 1317:1401, ack 1836, win 501, options [nop,nop,TS val 2734164869 ecr 3998090187], length 84
22:42:44.598656 IP ubuntu-s-2vcpu-4gb-tor1-01.ssh > 129.18.228.178.52558: Flags [.], ack 1401, win 524, options [nop,nop,TS val 3998100139 ecr 2734164869], length 0
22:42:46.421001 IP ubuntu-s-2vcpu-4gb-tor1-01.ssh > 129.18.228.178.52558: Flags [P.], seq 1836:1888, ack 1401, win 524, options [nop,nop,TS val 3998101961 ecr 2734164869], length 52
22:42:46.616094 IP 129.18.228.178.52558 > ubuntu-s-2vcpu-4gb-tor1-01.ssh: Flags [.], ack 1888, win 501, options [nop,nop,TS val 2734166928 ecr 3998101961], length 0
